{
	"schemaVersion": 1,
	"stage": "stage-7-ci-bootstrap",
	"capturedAt": "2026-08-06T23:59:13.879Z",
	"run": {
		"id": "stage7-20260806t235847z-9b15ab35",
		"logRoot": "evidence/stage-7-ci-run"
	},
	"source": {
		"baseSha": "75343aed70b712e3a6368cd059d13784a8c8e2f3",
		"implementationSha": "9b15ab355b401e366f8e6a37976f95a0f7e1521e",
		"treeClean": true
	},
	"host": {
		"os": "darwin",
		"architecture": "arm64",
		"kernel": "25.5.0",
		"ghVersion": "2.59.0"
	},
	"repository": {
		"nameWithOwner": "MrChrisRodriguez/devenv",
		"protectedBranch": "main",
		"workflowFile": ".github/workflows/ci.yml",
		"gateJobId": "ci-gate",
		"gateContext": "CI gate",
		"gateNeeds": ["ci", "image", "browser"],
		"negativeBranch": "evidence/stage-7-gate-negative"
	},
	"commands": [
		{
			"id": "ci-guard",
			"command": ["bun", "run", "ci:check"],
			"runId": "stage7-20260806t235847z-9b15ab35",
			"startedAt": "2026-08-06T23:58:47.586Z",
			"completedAt": "2026-08-06T23:58:47.661Z",
			"durationMs": 75,
			"stdoutPath": "evidence/stage-7-ci-run/ci-guard.stdout",
			"stderrPath": "evidence/stage-7-ci-run/ci-guard.stderr",
			"stdoutSha256": "9cfe650e97435463f535e1a81f5b30b1ab521cfb458af04688f901be57a294f9",
			"stderrSha256": "d183538a63c244d8ba196aa5a8eb1eb4cfc636414a9ba546e4cfb9b3537e4088",
			"exitCode": 0,
			"status": "pass"
		},
		{
			"id": "workflow-policy-mutations",
			"command": ["bun", "test", "scripts/template/__tests__/ci.test.ts"],
			"runId": "stage7-20260806t235847z-9b15ab35",
			"startedAt": "2026-08-06T23:58:47.664Z",
			"completedAt": "2026-08-06T23:59:03.233Z",
			"durationMs": 15569,
			"stdoutPath": "evidence/stage-7-ci-run/workflow-policy-mutations.stdout",
			"stderrPath": "evidence/stage-7-ci-run/workflow-policy-mutations.stderr",
			"stdoutSha256": "ca35b94f2c5b623fccbd1cc9e77eef3e30a6fcf4b045842fc1353f7ae6d8ea32",
			"stderrSha256": "0b70cf533c8fe9fbd1b35e6e75c7df5ddb705b3651238269ef8522b360a949c8",
			"exitCode": 0,
			"status": "pass"
		},
		{
			"id": "gate-semantics",
			"command": [
				"bash",
				"-c",
				"set -uo pipefail\nstatus=0\nRESULTS=\"success,success,success\" DRAFT=\"\" \\\n\tbash scripts/ci/aggregate-gate.sh >/dev/null 2>&1 || status=$?\nprintf 'case-push-every-job-succeeded=%s\\n' \"$status\"\nstatus=0\nRESULTS=\"success,skipped\" DRAFT=\"false\" \\\n\tbash scripts/ci/aggregate-gate.sh >/dev/null 2>&1 || status=$?\nprintf 'case-ready-success-and-skipped=%s\\n' \"$status\"\nstatus=0\nRESULTS=\"failure,success,success\" DRAFT=\"false\" \\\n\tbash scripts/ci/aggregate-gate.sh >/dev/null 2>&1 || status=$?\nprintf 'case-ready-one-job-failed=%s\\n' \"$status\"\nstatus=0\nRESULTS=\"success,cancelled\" DRAFT=\"false\" \\\n\tbash scripts/ci/aggregate-gate.sh >/dev/null 2>&1 || status=$?\nprintf 'case-ready-one-job-cancelled=%s\\n' \"$status\"\nstatus=0\nRESULTS=\"success,,success\" DRAFT=\"false\" \\\n\tbash scripts/ci/aggregate-gate.sh >/dev/null 2>&1 || status=$?\nprintf 'case-ready-one-result-empty=%s\\n' \"$status\"\nstatus=0\nRESULTS=\"\" DRAFT=\"false\" \\\n\tbash scripts/ci/aggregate-gate.sh >/dev/null 2>&1 || status=$?\nprintf 'case-ready-no-results-at-all=%s\\n' \"$status\"\nstatus=0\nRESULTS=\"skipped,skipped,skipped\" DRAFT=\"true\" \\\n\tbash scripts/ci/aggregate-gate.sh >/dev/null 2>&1 || status=$?\nprintf 'case-draft-every-job-skipped=%s\\n' \"$status\"\ndraft_message=\"$(RESULTS='skipped,skipped' DRAFT=true bash scripts/ci/aggregate-gate.sh 2>&1 1>/dev/null || true)\"\nprintf 'draftMessage=%s\\n' \"$draft_message\"\ngreen_output=\"$(RESULTS='success,success,success' DRAFT=false bash scripts/ci/aggregate-gate.sh 2>/dev/null || true)\"\nprintf 'greenOutput=%s\\n' \"$(printf '%s' \"$green_output\" | tr '\\n' '|')\"\nexit 0"
			],
			"runId": "stage7-20260806t235847z-9b15ab35",
			"startedAt": "2026-08-06T23:59:03.233Z",
			"completedAt": "2026-08-06T23:59:03.275Z",
			"durationMs": 42,
			"stdoutPath": "evidence/stage-7-ci-run/gate-semantics.stdout",
			"stderrPath": "evidence/stage-7-ci-run/gate-semantics.stderr",
			"stdoutSha256": "dfa8f07a8886fe8cac3166d2408a7774d0d142092932e1a3613e4fd7e404ed0b",
			"stderrSha256": "e3b0c44298fc1c149afbf4c8996fb92427ae41e4649b934ca495991b7852b855",
			"exitCode": 0,
			"status": "pass"
		},
		{
			"id": "rendered-workflow-graph",
			"command": [
				"bun",
				"scripts/template/collect-stage-seven-evidence.ts",
				"probe-render-graph",
				"--workspace",
				"/tmp/devenv-stage7-20260806t235847z-9b15ab35-render"
			],
			"runId": "stage7-20260806t235847z-9b15ab35",
			"startedAt": "2026-08-06T23:59:03.275Z",
			"completedAt": "2026-08-06T23:59:03.806Z",
			"durationMs": 531,
			"stdoutPath": "evidence/stage-7-ci-run/rendered-workflow-graph.stdout",
			"stderrPath": "evidence/stage-7-ci-run/rendered-workflow-graph.stderr",
			"stdoutSha256": "1c69e8ce97fb3c521371be6c3c3d94819b1bbb05b36ab8438c5c707df618591b",
			"stderrSha256": "e3b0c44298fc1c149afbf4c8996fb92427ae41e4649b934ca495991b7852b855",
			"exitCode": 0,
			"status": "pass"
		},
		{
			"id": "live-gate-green",
			"command": [
				"bash",
				"-c",
				"set -euo pipefail\nrun=\"$(gh run view 31132434357 --repo MrChrisRodriguez/devenv --json conclusion,createdAt,databaseId,event,headBranch,headSha,jobs,status,url,workflowName)\"\nprintf 'runJson=%s\\n' \"$(printf '%s' \"$run\" | python3 -c 'import json,sys; print(json.dumps(json.load(sys.stdin), sort_keys=True, separators=(\",\", \":\")))')\"\ngate=\"$(printf '%s' \"$run\" | python3 -c 'import json,sys; print([job[\"databaseId\"] for job in json.load(sys.stdin)[\"jobs\"] if job[\"name\"] == sys.argv[1]][0])' \"CI gate\")\"\nprintf 'gateJobId=%s\\n' \"$gate\"\nlog=\"$(gh run view --repo MrChrisRodriguez/devenv --job \"$gate\" --log)\"\nprintf 'gateLogSha256=%s\\n' \"$(printf '%s' \"$log\" | shasum -a 256 | awk '{ print $1 }')\"\nprintf 'upstreamResults=%s\\n' \"$(printf '%s\\n' \"$log\" | sed -n 's/.*upstream results: //p' | head -n 1)\"\nprintf 'gateVerdict=%s\\n' \"$(printf '%s\\n' \"$log\" | sed -n 's/.*##\\[error\\]//p' | head -n 1)\"\nprintf 'gateGreenLines=%s\\n' \"$(printf '%s\\n' \"$log\" | grep -c 'Every required job passed or was skipped' || true)\""
			],
			"runId": "stage7-20260806t235847z-9b15ab35",
			"startedAt": "2026-08-06T23:59:03.806Z",
			"completedAt": "2026-08-06T23:59:07.324Z",
			"durationMs": 3518,
			"stdoutPath": "evidence/stage-7-ci-run/live-gate-green.stdout",
			"stderrPath": "evidence/stage-7-ci-run/live-gate-green.stderr",
			"stdoutSha256": "0e45f76d05829a4af903d98837a8d657f09898c69157e11ced6b93e815ccc2ee",
			"stderrSha256": "e3b0c44298fc1c149afbf4c8996fb92427ae41e4649b934ca495991b7852b855",
			"exitCode": 0,
			"status": "pass"
		},
		{
			"id": "live-gate-red",
			"command": [
				"bash",
				"-c",
				"set -euo pipefail\nrun=\"$(gh run view 31132456715 --repo MrChrisRodriguez/devenv --json conclusion,createdAt,databaseId,event,headBranch,headSha,jobs,status,url,workflowName)\"\nprintf 'runJson=%s\\n' \"$(printf '%s' \"$run\" | python3 -c 'import json,sys; print(json.dumps(json.load(sys.stdin), sort_keys=True, separators=(\",\", \":\")))')\"\ngate=\"$(printf '%s' \"$run\" | python3 -c 'import json,sys; print([job[\"databaseId\"] for job in json.load(sys.stdin)[\"jobs\"] if job[\"name\"] == sys.argv[1]][0])' \"CI gate\")\"\nprintf 'gateJobId=%s\\n' \"$gate\"\nlog=\"$(gh run view --repo MrChrisRodriguez/devenv --job \"$gate\" --log)\"\nprintf 'gateLogSha256=%s\\n' \"$(printf '%s' \"$log\" | shasum -a 256 | awk '{ print $1 }')\"\nprintf 'upstreamResults=%s\\n' \"$(printf '%s\\n' \"$log\" | sed -n 's/.*upstream results: //p' | head -n 1)\"\nprintf 'gateVerdict=%s\\n' \"$(printf '%s\\n' \"$log\" | sed -n 's/.*##\\[error\\]//p' | head -n 1)\"\nprintf 'gateGreenLines=%s\\n' \"$(printf '%s\\n' \"$log\" | grep -c 'Every required job passed or was skipped' || true)\"\nprintf 'injectedFiles=%s\\n' \"$(git diff --name-only 9b15ab355b401e366f8e6a37976f95a0f7e1521e d789242f648d7d7fd3f5b57ef46d16ff509ae3f2 | tr '\\n' ' ')\"\nprintf 'injectedNumstat=%s\\n' \"$(git diff --numstat 9b15ab355b401e366f8e6a37976f95a0f7e1521e d789242f648d7d7fd3f5b57ef46d16ff509ae3f2 | tr '\\t' ' ' | tr '\\n' '|')\"\nprintf 'injectedLines=%s\\n' \"$(git diff 9b15ab355b401e366f8e6a37976f95a0f7e1521e d789242f648d7d7fd3f5b57ef46d16ff509ae3f2 | grep '^+[^+]' | sed 's/^+[[:space:]]*//' | grep . | tr '\\n' '|')\""
			],
			"runId": "stage7-20260806t235847z-9b15ab35",
			"startedAt": "2026-08-06T23:59:07.324Z",
			"completedAt": "2026-08-06T23:59:10.110Z",
			"durationMs": 2786,
			"stdoutPath": "evidence/stage-7-ci-run/live-gate-red.stdout",
			"stderrPath": "evidence/stage-7-ci-run/live-gate-red.stderr",
			"stdoutSha256": "6a7e2a1f2d7e033a05ade3b68398c3aaa04d71602d01fc2e8554ab0d3eb6f462",
			"stderrSha256": "e3b0c44298fc1c149afbf4c8996fb92427ae41e4649b934ca495991b7852b855",
			"exitCode": 0,
			"status": "pass"
		},
		{
			"id": "live-gate-draft",
			"command": [
				"bash",
				"-c",
				"set -euo pipefail\nrun=\"$(gh run view 31132439991 --repo MrChrisRodriguez/devenv --json conclusion,createdAt,databaseId,event,headBranch,headSha,jobs,status,url,workflowName)\"\nprintf 'runJson=%s\\n' \"$(printf '%s' \"$run\" | python3 -c 'import json,sys; print(json.dumps(json.load(sys.stdin), sort_keys=True, separators=(\",\", \":\")))')\"\ngate=\"$(printf '%s' \"$run\" | python3 -c 'import json,sys; print([job[\"databaseId\"] for job in json.load(sys.stdin)[\"jobs\"] if job[\"name\"] == sys.argv[1]][0])' \"CI gate\")\"\nprintf 'gateJobId=%s\\n' \"$gate\"\nlog=\"$(gh run view --repo MrChrisRodriguez/devenv --job \"$gate\" --log)\"\nprintf 'gateLogSha256=%s\\n' \"$(printf '%s' \"$log\" | shasum -a 256 | awk '{ print $1 }')\"\nprintf 'upstreamResults=%s\\n' \"$(printf '%s\\n' \"$log\" | sed -n 's/.*upstream results: //p' | head -n 1)\"\nprintf 'gateVerdict=%s\\n' \"$(printf '%s\\n' \"$log\" | sed -n 's/.*##\\[error\\]//p' | head -n 1)\"\nprintf 'gateGreenLines=%s\\n' \"$(printf '%s\\n' \"$log\" | grep -c 'Every required job passed or was skipped' || true)\""